<!ELEMENT personas (persona+)>
<!ELEMENT persona (nombre,mayor_de_edad?,ciudad,forma_pago+)>
<!ELEMENT nombre (#PCDATA)>
<!ELEMENT mayor_de_edad EMPTY>
<!ELEMENT ciudad (#PCDATA)>
<!ELEMENT forma_pago(#CDATA)>
<!ATTLIST forma_pago tipo (cheque|metálico) "metálico">